{
  "app_version" : "0.1.0",
  "capabilities" : {
    "byte_count" : 13,
    "mismatches" : [

    ],
    "named_bits" : [
      "FEAT_FlagM",
      "FEAT_FlagM2",
      "FEAT_FHM",
      "FEAT_DotProd",
      "FEAT_SHA3",
      "FEAT_RDM",
      "FEAT_LSE",
      "FEAT_SHA256",
      "FEAT_SHA512",
      "FEAT_SHA1",
      "FEAT_AES",
      "FEAT_PMULL",
      "FEAT_SB",
      "FEAT_FRINTTS",
      "FEAT_LRCPC",
      "FEAT_LRCPC2",
      "FEAT_FCMA",
      "FEAT_JSCVT",
      "FEAT_PAuth",
      "FEAT_PAuth2",
      "FEAT_FPAC",
      "FEAT_DPB",
      "FEAT_DPB2",
      "FEAT_BF16",
      "FEAT_I8MM",
      "FEAT_WFxT",
      "FEAT_RPRES",
      "FEAT_ECV",
      "FEAT_AFP",
      "FEAT_LSE2",
      "FEAT_CSV2",
      "FEAT_CSV3",
      "FEAT_DIT",
      "FEAT_FP16",
      "FEAT_BTI",
      "FEAT_SME",
      "FEAT_SME2",
      "FEAT_SME_F64F64",
      "FEAT_SME_I16I64",
      "FEAT_SME2p1",
      "FEAT_SME_F16F16",
      "FEAT_SME_B16B16",
      "AdvSIMD",
      "AdvSIMD_HPFPCvt",
      "FEAT_CRC32",
      "SME_F32F32",
      "SME_BI32I32",
      "SME_B16F32",
      "SME_F16F32",
      "SME_I8I32",
      "SME_I16I32",
      "FEAT_PACIMP",
      "FEAT_MTE",
      "FEAT_MTE2",
      "FEAT_MTE4",
      "FEAT_HBC",
      "FEAT_EBF16",
      "FEAT_CSSC",
      "FEAT_FPACCOMBINE",
      "FEAT_MTE_CANONICAL_TAGS",
      "FEAT_MTE_STORE_ONLY",
      "FEAT_MTE_NO_ADDRESS_TAGS",
      "FP_SyncExceptions",
      "FEAT_SVE_B16B16"
    ],
    "popcount" : 67,
    "unnamed_bits" : [
      38,
      39,
      59
    ]
  },
  "collected_at" : "2026-09-17T05:28:22Z",
  "collection" : {
    "data_versions" : {
      "caps_bits" : "2026-09-10",
      "cpufamily_names" : "2026-09-10",
      "documented_matrix" : "2026-09-10",
      "known_keys" : "2026-09-10",
      "soc_map" : "2026-09-10"
    },
    "kernel_formats_available" : true,
    "known_keys_version" : "2026-09-10",
    "walk_root" : "hw.optional",
    "walk_succeeded" : true
  },
  "device" : {
    "cpufamily" : "0xf76c5b1a",
    "cpufamily_name" : "CPUFAMILY_ARM_SOTRA",
    "cpusubfamily" : 5,
    "cpusubfamily_name" : "CPUSUBFAMILY_ARM_HC_HD",
    "hw_machine" : "arm64",
    "hw_model" : "Mac17,7",
    "hw_product" : "Mac17,7",
    "hw_target" : "J714cAP",
    "identity" : "Mac17,7",
    "marketing_name_inferred" : "unrecognized",
    "soc_id" : "T6050",
    "soc_inference_confidence" : "verified",
    "soc_name_inferred" : "Apple M5 (Pro/Max die; marketing tier unverified)"
  },
  "environment" : {
    "arch" : "arm64",
    "is_catalyst" : false,
    "is_ios_app_on_mac" : false,
    "is_simulator" : false,
    "is_translated" : false,
    "is_virtual_machine" : false,
    "kernel_version" : "Darwin Kernel Version 27.0.0: Tue Aug 11 21:06:40 PDT 2026; root:xnu-13432.1.9~1/RELEASE_ARM64_T6050",
    "os_build" : "26A428",
    "os_version" : "27.0",
    "platform" : "macOS"
  },
  "facts" : [
    {
      "category" : "context_cpu",
      "discovered_by" : "known_list",
      "display_name" : "CPU family",
      "id" : "hw.cpufamily",
      "kind" : "count",
      "provenance" : "measured",
      "raw" : {
        "errno" : null,
        "format" : "integer",
        "format_source" : "kernel",
        "key" : "hw.cpufamily",
        "length" : 4,
        "value" : -143893734
      },
      "state" : "value"
    },
    {
      "category" : "context_cpu",
      "discovered_by" : "known_list",
      "display_name" : "CPU subfamily",
      "id" : "hw.cpusubfamily",
      "kind" : "count",
      "provenance" : "measured",
      "raw" : {
        "errno" : null,
        "format" : "integer",
        "format_source" : "kernel",
        "key" : "hw.cpusubfamily",
        "length" : 4,
        "value" : 5
      },
      "state" : "value"
    },
    {
      "category" : "context_cpu",
      "discovered_by" : "known_list",
      "display_name" : "CPU subtype",
      "id" : "hw.cpusubtype",
      "kind" : "count",
      "provenance" : "measured",
      "raw" : {
        "errno" : null,
        "format" : "integer",
        "format_source" : "kernel",
        "key" : "hw.cpusubtype",
        "length" : 4,
        "value" : 2
      },
      "state" : "value"
    },
    {
      "category" : "context_cpu",
      "discovered_by" : "known_list",
      "display_name" : "CPU type",
      "id" : "hw.cputype",
      "kind" : "count",
      "provenance" : "measured",
      "raw" : {
        "errno" : null,
        "format" : "integer",
        "format_source" : "kernel",
        "key" : "hw.cputype",
        "length" : 4,
        "value" : 16777228
      },
      "state" : "value"
    },
    {
      "category" : "context_os",
      "discovered_by" : "known_list",
      "display_name" : "Engineering sample",
      "id" : "hw.engineering_sample",
      "kind" : "flag",
      "provenance" : "measured",
      "raw" : {
        "errno" : null,
        "format" : "integer",
        "format_source" : "kernel",
        "key" : "hw.engineering_sample",
        "length" : 4,
        "value" : 0
      },
      "state" : "not_present"
    },
    {
      "category" : "context_os",
      "discovered_by" : "known_list",
      "display_name" : "Security Research Device",
      "id" : "hw.features.allows_security_research",
      "kind" : "flag",
      "provenance" : "measured",
      "raw" : {
        "errno" : null,
        "format" : "integer",
        "format_source" : "kernel",
        "key" : "hw.features.allows_security_research",
        "length" : 4,
        "value" : 0
      },
      "state" : "not_present"
    },
    {
      "category" : "context_identity",
      "discovered_by" : "known_list",
      "display_name" : "Machine",
      "id" : "hw.machine",
      "kind" : "string",
      "provenance" : "measured",
      "raw" : {
        "errno" : null,
        "format" : "string",
        "format_source" : "kernel",
        "key" : "hw.machine",
        "length" : 6,
        "value" : "arm64"
      },
      "state" : "value"
    },
    {
      "category" : "context_cpu",
      "discovered_by" : "known_list",
      "display_name" : "Memory size",
      "id" : "hw.memsize",
      "kind" : "count",
      "provenance" : "measured",
      "raw" : {
        "errno" : null,
        "format" : "int64_t",
        "format_source" : "kernel",
        "key" : "hw.memsize",
        "length" : 8,
        "value" : 137438953472
      },
      "state" : "value"
    },
    {
      "category" : "context_identity",
      "discovered_by" : "known_list",
      "display_name" : "Model / board",
      "id" : "hw.model",
      "kind" : "string",
      "provenance" : "measured",
      "raw" : {
        "errno" : null,
        "format" : "string",
        "format_source" : "kernel",
        "key" : "hw.model",
        "length" : 8,
        "value" : "Mac17,7"
      },
      "state" : "value"
    },
    {
      "category" : "context_cpu",
      "discovered_by" : "known_list",
      "display_name" : "Logical CPUs",
      "id" : "hw.ncpu",
      "kind" : "count",
      "provenance" : "measured",
      "raw" : {
        "errno" : null,
        "format" : "integer",
        "format_source" : "kernel",
        "key" : "hw.ncpu",
        "length" : 4,
        "value" : 18
      },
      "state" : "value"
    },
    {
      "category" : "context_cpu",
      "discovered_by" : "known_list",
      "display_name" : "Performance levels",
      "id" : "hw.nperflevels",
      "kind" : "count",
      "provenance" : "measured",
      "raw" : {
        "errno" : null,
        "format" : "integer",
        "format_source" : "kernel",
        "key" : "hw.nperflevels",
        "length" : 4,
        "value" : 2
      },
      "state" : "value"
    },
    {
      "category" : "x86_isa",
      "discovered_by" : "both",
      "display_name" : "x86 adx",
      "id" : "adx",
      "kind" : "flag",
      "provenance" : "measured",
      "raw" : {
        "errno" : 45,
        "format" : null,
        "key" : "hw.optional.adx",
        "length" : 0
      },
      "state" : "not_applicable"
    },
    {
      "category" : "x86_isa",
      "discovered_by" : "both",
      "display_name" : "x86 aes",
      "id" : "aes",
      "kind" : "flag",
      "provenance" : "measured",
      "raw" : {
        "errno" : 45,
        "format" : null,
        "key" : "hw.optional.aes",
        "length" : 0
      },
      "state" : "not_applicable"
    },
    {
      "category" : "isa_simd",
      "discovered_by" : "both",
      "display_name" : "Advanced SIMD",
      "id" : "arm.AdvSIMD",
      "kind" : "flag",
      "provenance" : "measured",
      "raw" : {
        "errno" : null,
        "format" : "integer",
        "format_source" : "kernel",
        "key" : "hw.optional.arm.AdvSIMD",
        "length" : 4,
        "value" : 1
      },
      "state" : "present"
    },
    {
      "category" : "isa_simd",
      "discovered_by" : "both",
      "display_name" : "Advanced SIMD half-precision conversion",
      "id" : "arm.AdvSIMD_HPFPCvt",
      "kind" : "flag",
      "provenance" : "measured",
      "raw" : {
        "errno" : null,
        "format" : "integer",
        "format_source" : "kernel",
        "key" : "hw.optional.arm.AdvSIMD_HPFPCvt",
        "length" : 4,
        "value" : 1
      },
      "state" : "present"
    },
    {
      "category" : "isa_crypto",
      "discovered_by" : "both",
      "display_name" : "AES instructions",
      "id" : "arm.FEAT_AES",
      "kind" : "flag",
      "provenance" : "measured",
      "raw" : {
        "errno" : null,
        "format" : "integer",
        "format_source" : "kernel",
        "key" : "hw.optional.arm.FEAT_AES",
        "length" : 4,
        "value" : 1
      },
      "state" : "present"
    },
    {
      "category" : "isa_simd",
      "discovered_by" : "both",
      "display_name" : "Alternate floating-point behavior",
      "id" : "arm.FEAT_AFP",
      "kind" : "flag",
      "provenance" : "measured",
      "raw" : {
        "errno" : null,
        "format" : "integer",